{
  "outcome": "success",
  "startedAt": "1970-01-01T00:00:00.000Z",
  "endedAt": "1970-01-01T00:00:00.000Z",
  "elapsedMs": 1253,
  "runVars": {
    "origin": "203.0.113.1"
  },
  "calls": [
    {
      "index": 0,
      "outcome": "success",
      "startedAt": "1970-01-01T00:00:00.000Z",
      "endedAt": "1970-01-01T00:00:00.000Z",
      "request": {
        "url": "https://httpbin.org/post",
        "method": "post",
        "headers": {
          "Content-Type": "application/json",
          "User-Agent": "lace-probe/0.2.0 (lacelang-python)"
        }
      },
      "response": {
        "status": 200,
        "statusText": "OK",
        "headers": {
          "date": "Thu, 01 Jan 1970 00:00:00 GMT",
          "content-type": "application/json",
          "content-length": "540",
          "connection": "keep-alive",
          "server": "gunicorn/19.9.0",
          "access-control-allow-origin": "*",
          "access-control-allow-credentials": "true"
        },
        "bodyPath": null,
        "responseTimeMs": 710,
        "dnsMs": 23,
        "connectMs": 147,
        "tlsMs": 244,
        "ttfbMs": 666,
        "transferMs": 0,
        "sizeBytes": 540,
        "dns": {
          "resolvedIps": [
            "203.0.113.2",
            "203.0.113.3",
            "203.0.113.4",
            "203.0.113.5",
            "203.0.113.6",
            "203.0.113.7",
            "203.0.113.8",
            "203.0.113.9"
          ],
          "resolvedIp": "203.0.113.2"
        },
        "tls": {
          "protocol": "TLSv1.2",
          "cipher": "ECDHE-RSA-AES128-GCM-SHA256",
          "alpn": "http/1.1",
          "certificate": {
            "subject": {
              "cn": "httpbin.org"
            },
            "subjectAltNames": [
              "DNS:httpbin.org",
              "DNS:*.httpbin.org"
            ],
            "issuer": {
              "cn": "Amazon RSA 2048 M01"
            },
            "notBefore": "1970-01-01T00:00:00.000Z",
            "notAfter": "1970-01-01T00:00:00.000Z"
          }
        },
        "bodyNotCapturedReason": "notRequested"
      },
      "redirects": [],
      "assertions": [
        {
          "method": "expect",
          "scope": "status",
          "op": "eq",
          "outcome": "passed",
          "actual": 200,
          "expected": 200,
          "options": null
        }
      ],
      "config": {
        "body": {
          "type": "json",
          "value": {
            "email": "user@example.com",
            "action": "login"
          }
        },
        "timeout": {
          "ms": 30000,
          "action": "fail",
          "retries": 0
        },
        "redirects": {
          "follow": true,
          "max": 10
        },
        "security": {
          "rejectInvalidCerts": true
        }
      },
      "warnings": [],
      "error": null
    },
    {
      "index": 1,
      "outcome": "success",
      "startedAt": "1970-01-01T00:00:00.000Z",
      "endedAt": "1970-01-01T00:00:00.000Z",
      "request": {
        "url": "https://httpbin.org/get",
        "method": "get",
        "headers": {
          "Origin": "203.0.113.1",
          "User-Agent": "lace-probe/0.2.0 (lacelang-python)"
        }
      },
      "response": {
        "status": 200,
        "statusText": "OK",
        "headers": {
          "date": "Thu, 01 Jan 1970 00:00:00 GMT",
          "content-type": "application/json",
          "content-length": "326",
          "connection": "keep-alive",
          "server": "gunicorn/19.9.0",
          "access-control-allow-origin": "203.0.113.1",
          "access-control-allow-credentials": "true"
        },
        "bodyPath": null,
        "responseTimeMs": 539,
        "dnsMs": 22,
        "connectMs": 109,
        "tlsMs": 221,
        "ttfbMs": 482,
        "transferMs": 0,
        "sizeBytes": 326,
        "dns": {
          "resolvedIps": [
            "203.0.113.3",
            "203.0.113.9",
            "203.0.113.5",
            "203.0.113.8",
            "203.0.113.6",
            "203.0.113.7",
            "203.0.113.2",
            "203.0.113.4"
          ],
          "resolvedIp": "203.0.113.3"
        },
        "tls": {
          "protocol": "TLSv1.2",
          "cipher": "ECDHE-RSA-AES128-GCM-SHA256",
          "alpn": "http/1.1",
          "certificate": {
            "subject": {
              "cn": "httpbin.org"
            },
            "subjectAltNames": [
              "DNS:httpbin.org",
              "DNS:*.httpbin.org"
            ],
            "issuer": {
              "cn": "Amazon RSA 2048 M01"
            },
            "notBefore": "1970-01-01T00:00:00.000Z",
            "notAfter": "1970-01-01T00:00:00.000Z"
          }
        },
        "bodyNotCapturedReason": "notRequested"
      },
      "redirects": [],
      "assertions": [
        {
          "method": "expect",
          "scope": "status",
          "op": "eq",
          "outcome": "passed",
          "actual": 200,
          "expected": 200,
          "options": null
        },
        {
          "method": "check",
          "scope": "totalDelayMs",
          "op": "lt",
          "outcome": "passed",
          "actual": 539,
          "expected": 1000,
          "options": null
        }
      ],
      "config": {
        "headers": {
          "Origin": "203.0.113.1"
        },
        "timeout": {
          "ms": 30000,
          "action": "fail",
          "retries": 0
        },
        "redirects": {
          "follow": true,
          "max": 10
        },
        "security": {
          "rejectInvalidCerts": true
        }
      },
      "warnings": [],
      "error": null
    }
  ],
  "actions": {}
}
