{
  "outcome": "success",
  "startedAt": "1970-01-01T00:00:00.000Z",
  "endedAt": "1970-01-01T00:00:00.000Z",
  "elapsedMs": 570,
  "runVars": {},
  "calls": [
    {
      "index": 0,
      "outcome": "success",
      "startedAt": "1970-01-01T00:00:00.000Z",
      "endedAt": "1970-01-01T00:00:00.000Z",
      "request": {
        "url": "https://www.google.com/",
        "method": "get",
        "headers": {
          "User-Agent": "lace-probe/0.2.0 (lacelang-python)"
        }
      },
      "response": {
        "status": 200,
        "statusText": "OK",
        "headers": {
          "content-type": "text/html; charset=ISO-8859-1",
          "date": "Thu, 01 Jan 1970 00:00:00 GMT",
          "cache-control": "private, max-age=0",
          "content-security-policy-report-only": "object-src 'none';base-uri 'self';script-src 'nonce-KhIbZLaPVpEgY0dXpKJ-8w' 'strict-dynamic' 'report-sample' 'unsafe-eval' 'unsafe-inline' https: http:;report-uri https://csp.withgoogle.com/csp/gws/other-hp",
          "accept-ch": "Sec-CH-Prefers-Color-Scheme",
          "p3p": "CP=\"This is not a P3P policy! See g.co/p3phelp for more info.\"",
          "server": "gws",
          "x-xss-protection": "0",
          "x-frame-options": "SAMEORIGIN",
          "accept-ranges": "none",
          "vary": "Accept-Encoding",
          "transfer-encoding": "chunked"
        },
        "bodyPath": null,
        "responseTimeMs": 568,
        "dnsMs": 119,
        "connectMs": 18,
        "tlsMs": 59,
        "ttfbMs": 448,
        "transferMs": 66,
        "sizeBytes": 84696,
        "dns": {
          "resolvedIps": [
            "203.0.113.10",
            "203.0.113.11",
            "203.0.113.12",
            "203.0.113.13",
            "203.0.113.14",
            "203.0.113.15",
            "203.0.113.16",
            "203.0.113.17",
            "2001:4860:482a:7700::",
            "2001:4860:482d:7700::",
            "2001:4860:4829:7700::",
            "2001:4860:4828:7700::",
            "2001:4860:4826:7700::",
            "2001:4860:4827:7700::",
            "2001:4860:482c:7700::",
            "2001:4860:482b:7700::"
          ],
          "resolvedIp": "203.0.113.10"
        },
        "tls": {
          "protocol": "TLSv1.3",
          "cipher": "TLS_AES_256_GCM_SHA384",
          "alpn": "http/1.1",
          "certificate": {
            "subject": {
              "cn": "www.google.com"
            },
            "subjectAltNames": [
              "DNS:www.google.com"
            ],
            "issuer": {
              "cn": "WE2"
            },
            "notBefore": "1970-01-01T00:00:00.000Z",
            "notAfter": "1970-01-01T00:00:00.000Z"
          }
        },
        "bodyNotCapturedReason": "notRequested"
      },
      "redirects": [],
      "assertions": [
        {
          "method": "expect",
          "scope": "status",
          "op": "eq",
          "outcome": "passed",
          "actual": 200,
          "expected": 200,
          "options": null
        },
        {
          "method": "check",
          "scope": "totalDelayMs",
          "op": "lt",
          "outcome": "passed",
          "actual": 568,
          "expected": 1000,
          "options": null
        },
        {
          "method": "check",
          "scope": "ttfb",
          "op": "lt",
          "outcome": "failed",
          "actual": 448,
          "expected": 200,
          "options": null
        }
      ],
      "config": {
        "timeout": {
          "ms": 30000,
          "action": "fail",
          "retries": 0
        },
        "redirects": {
          "follow": true,
          "max": 10
        },
        "security": {
          "rejectInvalidCerts": true
        }
      },
      "warnings": [],
      "error": null
    }
  ],
  "actions": {}
}
