{
  "outcome": "failure",
  "startedAt": "1970-01-01T00:00:00.000Z",
  "endedAt": "1970-01-01T00:00:00.000Z",
  "elapsedMs": 602,
  "runVars": {},
  "calls": [
    {
      "index": 0,
      "outcome": "failure",
      "startedAt": "1970-01-01T00:00:00.000Z",
      "endedAt": "1970-01-01T00:00:00.000Z",
      "request": {
        "url": "https://httpbin.org/api/orders",
        "method": "get",
        "headers": {
          "User-Agent": "lace-probe/0.2.0 (lacelang-python)"
        }
      },
      "response": {
        "status": 404,
        "statusText": "NOT FOUND",
        "headers": {
          "date": "Thu, 01 Jan 1970 00:00:00 GMT",
          "content-type": "text/html",
          "content-length": "233",
          "connection": "keep-alive",
          "server": "gunicorn/19.9.0",
          "access-control-allow-origin": "*",
          "access-control-allow-credentials": "true"
        },
        "bodyPath": null,
        "responseTimeMs": 600,
        "dnsMs": 25,
        "connectMs": 184,
        "tlsMs": 215,
        "ttfbMs": 556,
        "transferMs": 0,
        "sizeBytes": 233,
        "dns": {
          "resolvedIps": [
            "203.0.113.2",
            "203.0.113.3",
            "203.0.113.9",
            "203.0.113.5",
            "203.0.113.7",
            "203.0.113.8",
            "203.0.113.4",
            "203.0.113.6"
          ],
          "resolvedIp": "203.0.113.2"
        },
        "tls": {
          "protocol": "TLSv1.2",
          "cipher": "ECDHE-RSA-AES128-GCM-SHA256",
          "alpn": "http/1.1",
          "certificate": {
            "subject": {
              "cn": "httpbin.org"
            },
            "subjectAltNames": [
              "DNS:httpbin.org",
              "DNS:*.httpbin.org"
            ],
            "issuer": {
              "cn": "Amazon RSA 2048 M01"
            },
            "notBefore": "1970-01-01T00:00:00.000Z",
            "notAfter": "1970-01-01T00:00:00.000Z"
          }
        },
        "bodyNotCapturedReason": "notRequested"
      },
      "redirects": [],
      "assertions": [
        {
          "method": "expect",
          "scope": "status",
          "op": "eq",
          "outcome": "failed",
          "actual": 404,
          "expected": 200,
          "options": {
            "notification": {
              "tag": "op_map",
              "ops": {
                "404": {
                  "tag": "template",
                  "name": "not_found_alert"
                },
                "500": {
                  "tag": "template",
                  "name": "server_error_alert"
                },
                "502": {
                  "tag": "template",
                  "name": "gateway_error_alert"
                },
                "503": {
                  "tag": "template",
                  "name": "service_unavailable_alert"
                },
                "default": {
                  "tag": "template",
                  "name": "unexpected_status_alert"
                }
              }
            }
          }
        }
      ],
      "config": {
        "timeout": {
          "ms": 30000,
          "action": "fail",
          "retries": 0
        },
        "redirects": {
          "follow": true,
          "max": 10
        },
        "security": {
          "rejectInvalidCerts": true
        }
      },
      "warnings": [],
      "error": null
    }
  ],
  "actions": {
    "notifications": [
      {
        "callIndex": 0,
        "conditionIndex": -1,
        "trigger": "expect",
        "scope": "status",
        "notification": {
          "tag": "template",
          "name": "not_found_alert"
        }
      }
    ]
  }
}
